{
  "envelopes": [
    {
      "correlationID": "55555555-5555-4555-8555-555555555555",
      "deviceID": "44444444-4444-4444-8444-444444444444",
      "epoch": 1,
      "messageID": "00000005-1111-4111-8111-111111111111",
      "messageKind": "recordingMetadata",
      "payload": {
        "createdAtEpochMilliseconds": 1700000000000,
        "localASRPolicy": "requiredLocal",
        "locationPolicy": "excluded",
        "mode": "transcript",
        "presetID": "66666666-6666-4666-8666-666666666666",
        "presetRevision": 7,
        "presetSnapshotHash": "0000000000000000000000000000000000000000000000000000000000000000",
        "recordingOnlyFilenamePolicyReference": null,
        "recordingOnlyFolderPolicyReference": null,
        "timezone": "UTC"
      },
      "protocolVersion": 1,
      "recordingID": "11111111-1111-4111-8111-111111111111",
      "replayRule": "newerRevisionWins",
      "revision": 1,
      "senderInstallationID": "33333333-3333-4333-8333-333333333333"
    },
    {
      "correlationID": "55555555-5555-4555-8555-555555555555",
      "deviceID": "44444444-4444-4444-8444-444444444444",
      "epoch": 1,
      "messageID": "00000006-1111-4111-8111-111111111111",
      "messageKind": "assetManifest",
      "payload": {
        "assetID": "77777777-7777-4777-8777-777777777777",
        "length": 1048576,
        "mediaType": "audio/wav",
        "sha256": "1111111111111111111111111111111111111111111111111111111111111111",
        "transport": "dataAsset"
      },
      "protocolVersion": 1,
      "recordingID": "11111111-1111-4111-8111-111111111111",
      "replayRule": "newerRevisionWins",
      "revision": 2,
      "senderInstallationID": "33333333-3333-4333-8333-333333333333"
    },
    {
      "correlationID": "55555555-5555-4555-8555-555555555555",
      "deviceID": "44444444-4444-4444-8444-444444444444",
      "epoch": 1,
      "messageID": "00000007-1111-4111-8111-111111111111",
      "messageKind": "transferFrontier",
      "payload": {
        "assetID": "77777777-7777-4777-8777-777777777777",
        "assetLength": 1048576,
        "assetSHA256": "1111111111111111111111111111111111111111111111111111111111111111",
        "chunkLength": 1048576,
        "chunkSequence": 0,
        "durableOffset": 1048576,
        "frontierRevision": 1
      },
      "protocolVersion": 1,
      "recordingID": "11111111-1111-4111-8111-111111111111",
      "replayRule": "newerRevisionWins",
      "revision": 3,
      "senderInstallationID": "33333333-3333-4333-8333-333333333333"
    },
    {
      "correlationID": "55555555-5555-4555-8555-555555555555",
      "deviceID": "44444444-4444-4444-8444-444444444444",
      "epoch": 1,
      "messageID": "00000009-1111-4111-8111-111111111111",
      "messageKind": "transferReceipt",
      "payload": {
        "assetID": "77777777-7777-4777-8777-777777777777",
        "durableOffset": 1048576,
        "frontierRevision": 1,
        "transportReceiptID": "88888888-8888-4888-8888-888888888888"
      },
      "protocolVersion": 1,
      "recordingID": "11111111-1111-4111-8111-111111111111",
      "replayRule": "idempotent",
      "revision": 4,
      "senderInstallationID": "33333333-3333-4333-8333-333333333333"
    },
    {
      "correlationID": "55555555-5555-4555-8555-555555555555",
      "deviceID": "44444444-4444-4444-8444-444444444444",
      "epoch": 1,
      "messageID": "0000000a-1111-4111-8111-111111111111",
      "messageKind": "phoneIngested",
      "payload": {
        "assetLength": 1048576,
        "assetSHA256": "1111111111111111111111111111111111111111111111111111111111111111",
        "durableReceiptID": "88888888-8888-4888-8888-888888888888",
        "phonePackageHash": "2222222222222222222222222222222222222222222222222222222222222222"
      },
      "protocolVersion": 1,
      "recordingID": "11111111-1111-4111-8111-111111111111",
      "replayRule": "idempotent",
      "revision": 5,
      "senderInstallationID": "33333333-3333-4333-8333-333333333333"
    },
    {
      "correlationID": "55555555-5555-4555-8555-555555555555",
      "deviceID": "44444444-4444-4444-8444-444444444444",
      "epoch": 1,
      "messageID": "0000000b-1111-4111-8111-111111111111",
      "messageKind": "vaultCommitted",
      "payload": {
        "destinationReceiptID": "88888888-8888-4888-8888-888888888888",
        "phoneIngestedCorrelationID": "55555555-5555-4555-8555-555555555555",
        "verifiedArtifactHash": "3333333333333333333333333333333333333333333333333333333333333333",
        "verifiedArtifactLength": 1048576
      },
      "protocolVersion": 1,
      "recordingID": "11111111-1111-4111-8111-111111111111",
      "replayRule": "terminal",
      "revision": 6,
      "senderInstallationID": "33333333-3333-4333-8333-333333333333"
    },
    {
      "correlationID": "55555555-5555-4555-8555-555555555555",
      "deviceID": "44444444-4444-4444-8444-444444444444",
      "epoch": 1,
      "messageID": "0000000e-1111-4111-8111-111111111111",
      "messageKind": "sourceDeletionAuthorized",
      "payload": {
        "authorizationThreshold": "vaultCommitted",
        "durableObservationReceiptID": "88888888-8888-4888-8888-888888888888",
        "vaultCommitCorrelationID": "55555555-5555-4555-8555-555555555555"
      },
      "protocolVersion": 1,
      "recordingID": "11111111-1111-4111-8111-111111111111",
      "replayRule": "terminal",
      "revision": 7,
      "senderInstallationID": "33333333-3333-4333-8333-333333333333"
    }
  ],
  "expectedDeletionPermitted": true,
  "expectedFinalState": "sourceDeletionAuthorized",
  "traceID": "99999999-9999-4999-8999-999999999999",
  "traceVersion": 1
}
